{
  "$schema": "../manifest.schema.json",
  "name": "local-kafka-dotnet-isolated-source-assembled",
  "qualificationMode": "release",
  "host": {
    "source": "git",
    "repository": "https://github.com/Azure/azure-functions-host.git",
    "commit": "d2ae50ace306501aca637ff18ba57db74a87b3ff",
    "runtimeImage": "mcr.microsoft.com/dotnet/aspnet:10.0.4-noble-amd64@sha256:f36bb81e345e2d2a4b483c75ead48484c729a40a38944a0e1772332b9ba045db"
  },
  "worker": {
    "language": "dotnet-isolated",
    "source": "git",
    "repository": "https://github.com/Azure/azure-functions-dotnet-worker.git",
    "commit": "fb1133321b86bbec32ee8dbdf22905f06b79ea51"
  },
  "kafkaExtension": {
    "source": "workspace",
    "repository": "https://github.com/Azure/azure-functions-kafka-extension.git",
    "ref": "HEAD"
  },
  "broker": {
    "kind": "local-kafka",
    "source": "container",
    "image": "confluentinc/cp-kafka:7.6.1@sha256:620734d9fc0bb1f9886932e5baf33806074469f40e3fe246a3fdbb59309535fa"
  },
  "functionApp": {
    "name": "compat-dotnet-isolated",
    "targetFramework": "net10.0",
    "workerVersion": "2.52.0",
    "workerSdkVersion": "2.1.0",
    "httpExtensionVersion": "3.3.0",
    "kafkaExtensionVersion": "4.3.0"
  },
  "packageFeeds": {
    "policy": "cfs-only",
    "azureDevOpsResource": "499b84ac-1321-427f-aa17-267ca6975798",
    "nuget": "https://pkgs.dev.azure.com/azfunc/public/_packaging/upstream-public/nuget/v3/index.json"
  },
  "toolchains": {
    "dotnetSdk": "10.0"
  },
  "buildTooling": {
    "source": "container",
    "dotnetSdkImage": "mcr.microsoft.com/dotnet/sdk:10.0@sha256:e1ffd2a92ae84c1291bc1b6887501f8af98e6331e7af6d4c8d37168c5e87a64c"
  }
}
